{"schema_version":"1.0","project_id":"demo","source":{"scene_id":"SC01","status":"locked","duration_target":8,"medium":"2D animation"},"beats":[{"beat_id":"B01","summary":"她发现戒指不见了","dialogue_ids":["D01"]},{"beat_id":"B02","summary":"他承认卖掉戒指","dialogue_ids":["D02"]}],"shots":[{"shot_id":"S01","beat_ids":["B01"],"duration_seconds":3,"visual_action":"她低头看见空着的无名指，抬眼望向他","camera":"双人中景缓慢收紧到她的反应","audio_dialogue":["D01"],"start_state":"两人隔桌站立","end_state":"她抬眼等待回答","cut_motivation":"scene_entry"},{"shot_id":"S02","beat_ids":["B02"],"duration_seconds":5,"visual_action":"他把视线移到桌面，停顿后承认卖掉戒指；她没有立刻回应","camera":"保持双人侧面构图，让两人的距离留在画面中","audio_dialogue":["D02"],"start_state":"她抬眼等待回答","end_state":"两人之间的沉默变成新的关系状态","cut_motivation":"reaction"}],"clip_groups":[{"clip_id":"C01","shot_ids":["S01","S02"],"duration_seconds":8,"engine":"generic","transition_anchor":"同一桌面与视线关系"}],"warnings":[]}
